Artificial intelligence Engineer,Backend Developer,Cloud Computing Engineer,Computer Scientist,Data Analyst,Data Engineer,Data Scientist,DevOps,Database Administrator,Embedded Systems Developer,FrontEnd Developer,Fullstack Developer,Game Developer,IT Manager,Machine Learning Engineer,Network Engineer,QA Tester,Software Engineer,System Administrator,UX/UI Designer
Creative problem-solving skills,The basics of web design,The basics of web design,Object-oriented analysis and design,Business statistics,Business statistics,Object-oriented analysis and design,Object-oriented analysis and design ,Object-oriented analysis and design ,Computer components,Basics of web disney,The basics of web design,The basics of web design,Object-oriented analysis and design,Business statistics,The basics of cybersecurity,The basics of web design,Object-oriented analysis and disney,Object-oriented analysis and design,The basics of web design
Analysis of software requirements,Internet technologies,Software engineering,Software engineering,Advanced programming,Software engineering,Software engineering,Internet technologies,Software engineering,Engineering mathematics,Internet technologies,Software engineering,Software engineering,Software engineering,Basics of information theory,Internet technologies,Software engineering,Internet services,Advanced programming,Software engineering
Introduction to random processes,Advanced programming,Internet technologies,Internet technologies,Software engineering,Artificial intelligence,Algorithm design,Basics of information theory,Unstructured databases,Sustainable and energy efficient computer systems,User Interface Design Template,Analysis of software requirements,Computer graphics,Advanced programming,Digital image processing,Advanced programming,Analysis of software requirements,Software engineering,Software engineering,Advanced programming
Digital image processing,Analysis of software requirements,Advanced programming,Analysis of software requirements,Visualization,Algorithm design,Basics of information theory,Software engineering,Data-based administration,Algorithm design,Internet programming on a client page,Internet technologies,Engineering mathematics,Analysis of software requirements,Introduction to random processes,Wireless and mobile systems,Advanced programming,Advanced programming,Analysis of software requirements,Economy for ICT engineers
Advanced programming,Visual programming,Analysis of software requirements,Algorithm design,Parallel and distributed processing,Analysis of software requirements,Artificial intelligence,Web programming,Advanced databases,Wireless and mobile systems,Analysis of software requirements,Internet programming on a client page,Internet technologies,Media and communications,Artificial intelligence,Software engineering,Software quality and testing,Analysis of software requirements,Internet technologies,User Interface Design Templates
Software engineering,Software engineering,System Administration,Information theory with digital communications,Mining massive data,Advanced programming,Introduction to data science,Information security,Information security,Machine learning,Computer graphics,Advanced programming,Internet programming on a client page,Concepts of an information society,Statistical modelling,Web programming,Management Information Systems,Information security,Artificial intelligence,Computer graphics
Artificial intelligence,Virtualization,Advanced web design,Introduction to network science,Introduction to data science,Virtualization,Data mining,Software design and architecture,Virtualization,Built-in microprocessor systems,Software engineering,Machine learning ,Artificial intelligence,E - government ,Parallel and distributed processing,Implementation of free and open source systems,Web programming,Network Security,Analysis and design on IS,Computer ethics
Data mining,Web programming,Virtualization,Implementation of free and open source systems,Unstructured databases,Web programming,Mining massive data,Distributed systems,Cloud computing,Introduction to smart cities,Web programming,Cryptography,Video game programming ,Web programming,Machine learning,Information security,Advanced web design,Built-in microprocessor systems,Web-based systems ,Human computer interaction design
Virtualization,Service-oriented architectures,Web programming,Parallel and distributed processing,Warehouse and analytical processing data,Implementation of free and open source systems,Introduction to time series analysis,Service-oriented architectures,Data warehouses and analytical processing,Internet of Things,Web-based systems,Web programming,Implementation of free and open source systems,Implementation of free and open source systems,Processing of natural languages,Network Security,,Web programming,Ethical hacking,Advanced web design
Parallel and distributed processing,Integrated systems,Service-oriented architectures,Built-in microprocessor systems,Data mining,Software design and architecture,Machine learning,Ethical hacking,Sharing and calculating in a crowd,Modern computer architectures,Visualization,Advanced web design,Machine learning,Built-in microprocessor systems,Introduction to time series analysis,Software-defined networks,,Virtualization,Software-defined networks,Team project
Statistical modelling,Team project,Implementation of free and open source systems,Statistical modelling,Decision support systems ,System Administration,Statistical modelling,Computer network design,Distributed data storage,Built-in system software,Implementation of free and open source systems,Electronic and mobile trade,Advanced web design,IcT Project Management,Introduction to shape recognition,Software-defined security,,Software quality and testing,Software-defined security,Visualization
Biologically inspired calculation,Unstructured databases,Distributed systems,Basics of robotics,Modelling and simulation,Advanced databases,Smart information systems,Online Administration,Continued integration and delivery,Basics of robotics,Human-computer interaction design,Web-based systems,Human-computer interaction design,Web-based systems ,Machine vision,Optical networks,,Integrated systems,Implementation of free and open source systems,Multimedia systems
Visualization,Implementation of free and open source systems,Cloud computing,Formal languages and vending machines,Measurement and analysis of internet traffic,Unstructured databases,Data warehouses and analytical processing,Data-based administration,Visualization,Autonomous robotics,Advanced Human Interaction - Computer,Integrated systems,Built-in microprocessor systems,Management Information Systems,Linear algebra and applications ,Introduction to network science,,Software design and architecture,Cloud computing,School-age psychology
Introduction to time series analysis,Electronic and mobile trade,Modern computer architectures,Virtualization,Geographical information systems,Data warehouses and analytical processing,Unstructured databases,System Administration,Introduction to network science,Process robotics,Electronic and mobile trade,Human-computer interaction design,Visualization,Entrepreneurship,Smart information systems,Wireless multimedia systems,,Electronic and mobile trade,Electronic and mobile trade,Computer animation
Introduction to bioinformatics,Distributed systems,Parallel and distributed processing,Software design and architecture,Introduction to shape recognition,Distributed data storage,Visualization,Virtualization,Infrastructure programming,Modern trends in robotics,Computer animation,Implementation of free and open source systems,Team project,Computer ethics,Agent-based systems ,Measurement and analysis of internet traffic,,Team project,Software design and architecture,Advanced human computer interaction
Introduction to cognitive sciences,Web-based systems,Continued integration and delivery,Web-based systems ,Introduction to time series analysis,Data mining,Processing of natural languages,Continued integration and delivery,Distributed systems,Wireless multimedia systems,Advanced web design,Software design and architecture,Computer animation,Innovation in ICT,Mining massive data,Cryptography ,,Cloud computing,Integrated systems,
Introduction to data science,Design and architectural software,Infrastructure programming,Mining massive data,Web-based systems,Mining massive data,Introduction to shape recognition,Infrastructure programming,,,,Unstructured databases,Virtual reality,Analysis and design on IS,Unstructured databases,Multimedia networks,,Implementation of free and open source systems,Virtualization,
